{
  "fileKey": "ocdacdEsnHipMJD3egzxKb",
  "generatedBy": "design-parity-kit-index",
  "sets": {
    "57994:2328": {
      "name": "Toggle button",
      "variants": [
        {
          "id": "57994:2449",
          "name": "Type=Square, Size=XLarge, State=Enabled, Selected=True"
        },
        {
          "id": "58653:20310",
          "name": "Type=Square, Size=XLarge, State=Hovered, Selected=True"
        },
        {
          "id": "58653:20430",
          "name": "Type=Square, Size=XLarge, State=Focused, Selected=True"
        },
        {
          "id": "58653:20550",
          "name": "Type=Square, Size=XLarge, State=Pressed, Selected=True"
        },
        {
          "id": "58653:20670",
          "name": "Type=Square, Size=XLarge, State=Disabled, Selected=True"
        },
        {
          "id": "57994:2451",
          "name": "Type=Square, Size=Large, State=Enabled, Selected=True"
        },
        {
          "id": "58653:20312",
          "name": "Type=Square, Size=Large, State=Hovered, Selected=True"
        },
        {
          "id": "58653:20432",
          "name": "Type=Square, Size=Large, State=Focused, Selected=True"
        },
        {
          "id": "58653:20552",
          "name": "Type=Square, Size=Large, State=Pressed, Selected=True"
        },
        {
          "id": "58653:20672",
          "name": "Type=Square, Size=Large, State=Disabled, Selected=True"
        },
        {
          "id": "57994:2453",
          "name": "Type=Square, Size=Medium, State=Enabled, Selected=True"
        },
        {
          "id": "58653:20314",
          "name": "Type=Square, Size=Medium, State=Hovered, Selected=True"
        },
        {
          "id": "58653:20434",
          "name": "Type=Square, Size=Medium, State=Focused, Selected=True"
        },
        {
          "id": "58653:20554",
          "name": "Type=Square, Size=Medium, State=Pressed, Selected=True"
        },
        {
          "id": "58653:20674",
          "name": "Type=Square, Size=Medium, State=Disabled, Selected=True"
        },
        {
          "id": "57994:2455",
          "name": "Type=Square, Size=Small, State=Enabled, Selected=True"
        },
        {
          "id": "58653:20316",
          "name": "Type=Square, Size=Small, State=Hovered, Selected=True"
        },
        {
          "id": "58653:20436",
          "name": "Type=Square, Size=Small, State=Focused, Selected=True"
        },
        {
          "id": "58653:20556",
          "name": "Type=Square, Size=Small, State=Pressed, Selected=True"
        },
        {
          "id": "58653:20676",
          "name": "Type=Square, Size=Small, State=Disabled, Selected=True"
        },
        {
          "id": "57994:2457",
          "name": "Type=Square, Size=XSmall, State=Enabled, Selected=True"
        },
        {
          "id": "58653:20318",
          "name": "Type=Square, Size=XSmall, State=Hovered, Selected=True"
        },
        {
          "id": "58653:20438",
          "name": "Type=Square, Size=XSmall, State=Focused, Selected=True"
        },
        {
          "id": "58653:20558",
          "name": "Type=Square, Size=XSmall, State=Pressed, Selected=True"
        },
        {
          "id": "58653:20678",
          "name": "Type=Square, Size=XSmall, State=Disabled, Selected=True"
        },
        {
          "id": "57994:2459",
          "name": "Type=Square, Size=XLarge, State=Enabled, Selected=False"
        },
        {
          "id": "58653:19830",
          "name": "Type=Square, Size=XLarge, State=Hovered, Selected=False"
        },
        {
          "id": "58653:19950",
          "name": "Type=Square, Size=XLarge, State=Focused, Selected=False"
        },
        {
          "id": "58653:20070",
          "name": "Type=Square, Size=XLarge, State=Pressed, Selected=False"
        },
        {
          "id": "58653:20190",
          "name": "Type=Square, Size=XLarge, State=Disabled, Selected=False"
        },
        {
          "id": "57994:2461",
          "name": "Type=Square, Size=Large, State=Enabled, Selected=False"
        },
        {
          "id": "58653:19832",
          "name": "Type=Square, Size=Large, State=Hovered, Selected=False"
        },
        {
          "id": "58653:19952",
          "name": "Type=Square, Size=Large, State=Focused, Selected=False"
        },
        {
          "id": "58653:20072",
          "name": "Type=Square, Size=Large, State=Pressed, Selected=False"
        },
        {
          "id": "58653:20192",
          "name": "Type=Square, Size=Large, State=Disabled, Selected=False"
        },
        {
          "id": "57994:2463",
          "name": "Type=Square, Size=Medium, State=Enabled, Selected=False"
        },
        {
          "id": "58653:19834",
          "name": "Type=Square, Size=Medium, State=Hovered, Selected=False"
        },
        {
          "id": "58653:19954",
          "name": "Type=Square, Size=Medium, State=Focused, Selected=False"
        },
        {
          "id": "58653:20074",
          "name": "Type=Square, Size=Medium, State=Pressed, Selected=False"
        },
        {
          "id": "58653:20194",
          "name": "Type=Square, Size=Medium, State=Disabled, Selected=False"
        },
        {
          "id": "57994:2465",
          "name": "Type=Square, Size=Small, State=Enabled, Selected=False"
        },
        {
          "id": "58653:19836",
          "name": "Type=Square, Size=Small, State=Hovered, Selected=False"
        },
        {
          "id": "58653:19956",
          "name": "Type=Square, Size=Small, State=Focused, Selected=False"
        },
        {
          "id": "58653:20076",
          "name": "Type=Square, Size=Small, State=Pressed, Selected=False"
        },
        {
          "id": "58653:20196",
          "name": "Type=Square, Size=Small, State=Disabled, Selected=False"
        },
        {
          "id": "57994:2467",
          "name": "Type=Square, Size=XSmall, State=Enabled, Selected=False"
        },
        {
          "id": "58653:19838",
          "name": "Type=Square, Size=XSmall, State=Hovered, Selected=False"
        },
        {
          "id": "58653:19958",
          "name": "Type=Square, Size=XSmall, State=Focused, Selected=False"
        },
        {
          "id": "58653:20078",
          "name": "Type=Square, Size=XSmall, State=Pressed, Selected=False"
        },
        {
          "id": "58653:20198",
          "name": "Type=Square, Size=XSmall, State=Disabled, Selected=False"
        },
        {
          "id": "57994:2469",
          "name": "Type=Round, Size=XLarge, State=Enabled, Selected=True"
        },
        {
          "id": "58653:20320",
          "name": "Type=Round, Size=XLarge, State=Hovered, Selected=True"
        },
        {
          "id": "58653:20440",
          "name": "Type=Round, Size=XLarge, State=Focused, Selected=True"
        },
        {
          "id": "58653:20560",
          "name": "Type=Round, Size=XLarge, State=Pressed, Selected=True"
        },
        {
          "id": "58653:20680",
          "name": "Type=Round, Size=XLarge, State=Disabled, Selected=True"
        },
        {
          "id": "57994:2471",
          "name": "Type=Round, Size=Large, State=Enabled, Selected=True"
        },
        {
          "id": "58653:20322",
          "name": "Type=Round, Size=Large, State=Hovered, Selected=True"
        },
        {
          "id": "58653:20442",
          "name": "Type=Round, Size=Large, State=Focused, Selected=True"
        },
        {
          "id": "58653:20562",
          "name": "Type=Round, Size=Large, State=Pressed, Selected=True"
        },
        {
          "id": "58653:20682",
          "name": "Type=Round, Size=Large, State=Disabled, Selected=True"
        },
        {
          "id": "57994:2473",
          "name": "Type=Round, Size=Medium, State=Enabled, Selected=True"
        },
        {
          "id": "58653:20324",
          "name": "Type=Round, Size=Medium, State=Hovered, Selected=True"
        },
        {
          "id": "58653:20444",
          "name": "Type=Round, Size=Medium, State=Focused, Selected=True"
        },
        {
          "id": "58653:20564",
          "name": "Type=Round, Size=Medium, State=Pressed, Selected=True"
        },
        {
          "id": "58653:20684",
          "name": "Type=Round, Size=Medium, State=Disabled, Selected=True"
        },
        {
          "id": "57994:2475",
          "name": "Type=Round, Size=Small, State=Enabled, Selected=True"
        },
        {
          "id": "58653:20326",
          "name": "Type=Round, Size=Small, State=Hovered, Selected=True"
        },
        {
          "id": "58653:20446",
          "name": "Type=Round, Size=Small, State=Focused, Selected=True"
        },
        {
          "id": "58653:20566",
          "name": "Type=Round, Size=Small, State=Pressed, Selected=True"
        },
        {
          "id": "58653:20686",
          "name": "Type=Round, Size=Small, State=Disabled, Selected=True"
        },
        {
          "id": "57994:2477",
          "name": "Type=Round, Size=XSmall, State=Enabled, Selected=True"
        },
        {
          "id": "58653:20328",
          "name": "Type=Round, Size=XSmall, State=Hovered, Selected=True"
        },
        {
          "id": "58653:20448",
          "name": "Type=Round, Size=XSmall, State=Focused, Selected=True"
        },
        {
          "id": "58653:20568",
          "name": "Type=Round, Size=XSmall, State=Pressed, Selected=True"
        },
        {
          "id": "58653:20688",
          "name": "Type=Round, Size=XSmall, State=Disabled, Selected=True"
        },
        {
          "id": "57994:2479",
          "name": "Type=Round, Size=XLarge, State=Enabled, Selected=False"
        },
        {
          "id": "58653:19840",
          "name": "Type=Round, Size=XLarge, State=Hovered, Selected=False"
        },
        {
          "id": "58653:19960",